,Title,Abstract,Category,Words
51,Business intelligence capabilities as facilitators to achieve organizational agility,"Today's business environment is characterized by fast and unexpected changes, many of which are driven by technological advancement. In such environment, the ability to respond effectively and adapt to the new requirements is not only desirable but essential to survive. Comprehensive and quick understanding of intricacies of market changes facilitates firm's faster and better response. Two concepts contribute to the success of this scenario; organizational agility and business intelligence (BI). As of today, despite BI's capabilities to foster organizational agility and consequently improve organizational performance, a clear link between BI and organizational agility has not been established. In this paper we argue that BI solutions have the potential to be facilitators for achieving agility. We aim at showing how BI capabilities can help achieve agility at operational, portfolio, and strategic levels. Business intelligence capabilities as facilitators to achieve organizational agility",Governance, business environment characterized fast unexpected change  driven technological advancement environment  respond effectively adapt  requirement desirable essential survive comhensive quick understanding intricacy market change facilitates firm faster better response two  contribute success scenario organizational agility business intelligence   despite  cap foster organizational agility  improve organizational performance clear link  organizational agility established  argue  solution potential facilitator achieving agility  ing  cap   agility operational  strategic  business intelligence cap facilitator  organizational agility
52,Towards successful establishment of a project portfolio management system: Business process management approach,"Linking structures, processes and resources with corporate strategies is a key requirement of today's organizations, bringing about integration toward achieving long-term objectives. Organizations can no longer rely on traditional practices since advance Towards successful establishment of a project portfolio management system: Business process management approach",Governance,linking structure  resource corporate strategy  requirement  organization bringing integration toward achieving   objective organization  rely traditional practice since advance towards successful establishment     business   approach
53,Corporate Governance of the Project-Oriented Company Contributing to Its Sustainable Development,"Different corporate governance structures are appropriate for different company types. Given the specifics of the project-oriented company, which manages unique business processes of medium to large scope by projects and by programs, specific governing s Corporate Governance of the Project-Oriented Company Contributing to Its Sustainable Development",Governance, corporate governance structure appropriate  company type  specific  oriented company  unique business  medium large scope  program specific governing corporate governance  oriented company contributing sustainable development
54,Exploring the roles of portfolio steering committees in project portfolio governance,"Governing project portfolios engages different actors in organizations including portfolio managers, portfolio officers, top managers, and others who may team up as portfolio steering committees. While portfolio steering committees play a regular role in Exploring the roles of portfolio steering committees in project portfolio governance",Governance,governing   engages  actor organization including    officer top  others may team  steering committee  steering committee play regular role exploring role  steering committee   governance
55,Improving the realization of IT demands: A design theory for end-to-end demand management,"With the growing penetration of IT and its critical role within organizations, the number of requests for IT services and solutions is steadily increasing. However, many companies lack a consolidated view of all these requests or demands. They also strug Improving the realization of IT demands: A design theory for end-to-end demand management",Governance,growing penetration critical role  organization  request service solution steadily increasing   company lack consolidated view request demand  strug improving realization demand design theory end  end demand 
56,"Governance and governmentality for projects: Enablers, practices, and consequences","This research-based book takes an organization-wide perspective to describe the governance and governmentality for projects in organizations. Governance of projects defines and directs the ways managers of projects, programs, and project portfolios carry Governance and governmentality for projects: Enablers, practices, and consequences",Governance,research based book take organization wide perspective describe governance governmentality  organization governance  defines directs way   program   carry governance governmentality  enablers practice consequence
57,"International Conference on Information Systems, ICIS 2012, Volume 5","The proceedings contain 308 papers. The special focus in this conference is on Information Systems. The topics include: Heterogeneity in IT landscapes and monopoly power of firms; community ecology for innovation concept; peer influence in a very large s International Conference on Information Systems, ICIS 2012, Volume 5",Monitoring and control,proceeding     special  conference information  topic  heterogeneity landscape monopoly power firm community ecology innovation  peer influence large international conference information  icis   volume  
58,Balancing the portfolio of urban and public projects with distance-dependent coverage facilities,"The portfolio of urban and public projects should be balanced in terms of completion time, districts, and strategic objectives. For this purpose, we suggest a mixed-integer nonlinear programming model based on the goal programming approach. Projects are  Balancing the portfolio of urban and public projects with distance-dependent coverage facilities",Monitoring and control, urban   balanced  completion  district strategic objective  suggest mixed integer linear programming model based goal programming approach  balancing  urban   distance dependent coverage facility
59,"15th Wuhan International Conference on E-Business, WHICEB 2016","The proceedings contain 70 papers. The special focus in this conference is on E-Business. The topics include: An Empirical Research on Hotel Revenue Management Financial Performance Influencing Factors; an Empirical Research on the Evaluation System of C 15th Wuhan International Conference on E-Business, WHICEB 2016",Monitoring and control,proceeding     special  conference  business topic  empirical research hotel revenue  financial performance influencing factor empirical research evaluation     wuhan international conference  business whiceb  
60,"International Conference on Information Systems, ICIS 2012, Volume 4","The proceedings contain 308 papers. The special focus in this conference is on Information Systems. The topics include: Heterogeneity in IT landscapes and monopoly power of firms; community ecology for innovation concept; peer influence in a very large s International Conference on Information Systems, ICIS 2012, Volume 4",Monitoring and control,proceeding     special  conference information  topic  heterogeneity landscape monopoly power firm community ecology innovation  peer influence large international conference information  icis   volume  
61,"International Conference on Information Systems, ICIS 2012, Volume 1","The proceedings contain 308 papers. The special focus in this conference is on Information Systems. The topics include: Heterogeneity in IT landscapes and monopoly power of firms; community ecology for innovation concept; peer influence in a very large s International Conference on Information Systems, ICIS 2012, Volume 1",Monitoring and control,proceeding     special  conference information  topic  heterogeneity landscape monopoly power firm community ecology innovation  peer influence large international conference information  icis   volume  
62,Object oriented Petri nets usage in project portfolio modeling domain,"The paper presents a way, how the Petri net technique, in concrete, Object Oriented Petri Nets (OO PN) can be applied in project management domain. There is shown the use of Object Oriented approach and concepts in project planning, organizing, monitorin Object oriented Petri nets usage in project portfolio modeling domain",Monitoring and control,  way petri net technique concrete object oriented petri net   applied   domain   object oriented approach   planning organizing monitorin object oriented petri net usage   modeling domain
63,Project portfolio implementation under uncertainty and interdependencies: A simulation study of behavioural responses,"Even though systems thinking has been highlighted in portfolio management theory, independent project control logic still dominates its implementation process. This paper constructs a system dynamics model for portfolio monitoring and control. Considerin Project portfolio implementation under uncertainty and interdependencies: A simulation study of behavioural responses",Monitoring and control,even though  thinking highlighted   theory independent  control logic still dominates implementation   construct  dynamic model  monitoring control considerin   implementation uncertainty interdependency simulation study behavioural response
64,Optimal project portfolio selection with reinvestment strategy considering sustainability in an uncertain environment: a multi-objective optimization approach,"Purpose: This study aims to develop a model for project portfolio selection considering organizational goals such as budgets, sustainability cash flow and reinvestment strategy under an uncertain environment. Design/methodology/approach: A multi-objectiv Optimal project portfolio selection with reinvestment strategy considering sustainability in an uncertain environment: a multi-objective optimization approach",Monitoring and control, study  develop model   selection considering organizational goal budget sustain cash flow reinvestment strategy uncertain environment design methodology approach multi objectiv optimal   selection reinvestment strategy considering sustain uncertain environment multi objective optimization approach
65,Vaikuttavaa tutkimusta arviointikäytäntöjä julkisissa tutkimusorganisaatioissa: Helia ja SAMK,"The role of the polytechnics (also referred to as ""universities of applied sciences"") in the Finnish innovation system has, from rather humble beginnings, steadily increased in importance. The development of their knowledge base has become an integral pa Vaikuttavaa tutkimusta arviointikäytäntöjä julkisissa tutkimusorganisaatioissa: Helia ja SAMK",Monitoring and control,role polytechnic  referred university applied science finnish innovation  rather humble beginning steadily increased importance development knowledge base  integral  vaikuttavaa tutkimusta arviointikaytantoja julkisissa tutkimusorganisaatioissa helia  samk
66,Performance management systems for project management offices: A case-based study,"Project Management Offices (PMOs) are organizational structures in charge of managing and coordinating several simultaneous projects within companies. Due to the complexity of different projects' objectives, it is usual to simplify project indicators and  Performance management systems for project management offices: A case-based study",Monitoring and control,  office pmos organizational structure charge managing coordinating  simultaneous   company due complexity   objective usual simplify  indicator performance     office  based study
67,"International Conference on Information Systems, ICIS 2012, Volume 5","The proceedings contain 308 papers. The special focus in this conference is on Information Systems. The topics include: Heterogeneity in IT landscapes and monopoly power of firms; community ecology for innovation concept; peer influence in a very large s International Conference on Information Systems, ICIS 2012, Volume 5",Monitoring and control,proceeding     special  conference information  topic  heterogeneity landscape monopoly power firm community ecology innovation  peer influence large international conference information  icis   volume  
68,Data science approach for it project management,"Majority of the IT companies realized that ability to analyse and use data, could be one of the key factors for increasing of number of successful projects, portfolios, programs. Key performance indicators based on data analysis helps organizations be mo Data science approach for it project management",Monitoring and control,majority company   analyse  data could   factor increasing  successful   program  performance indicator based data analysis  organization  data science approach  
69,Improving Project Control by Utilizing Predictive Data Analytic Models,"Project progress is an apprehension for every project, as it indicates how the project is likely to meet the associated milestones. Utilizing collected data from archived projects can assist managers to envisage project progress. By leveraging the power of data analytics, this research attempts to highlight data trends based on data collected from 279 infrastructure projects in the UAE. Specifically, this research rigorously analyses the relationships between project budget, duration, and progress using K-means clustering techniques and hypothesis testing. We then provide predictive models using Autoregressive Integrated Moving Average - ARIMA and Multivariate regression models that allow managers to predict with a 99.15% accuracy the monthly progress of an infrastructure project over the next 3 months. This research paper provides project managers with a comprehensive framework that combines data analytics techniques with agility practices to predict short term project progress in order to take proactive measures on the different influencing factors.  © IEEE 2022. Improving Project Control by Utilizing Predictive Data Analytic Models",Monitoring and control, progress aphension every  indicates  likely meet associated milest utilizing collected data archived  assist  envisage  progress leveraging power data analytics research attempt highlight data trend based data collected   infrastructure  uae specifically research rigorously analysis relationship  budget duration progress   means clustering technique hypothesis testing provide dictive model  autoregressive integrated moving average arima multivariate regression model allow  dict   accuracy monthly progress infrastructure  next   month research  provides   comhensive framework combine data analytics technique agility practice dict short   progress order take proactive measure  influencing factor ieee   improving  control utilizing dictive data analytic model
70,Using analytics to predict project management success,"IT projects normally face time and cost overruns challenges. Predicting which projects will not be completed by the expected end date (time overrun) and within the allotted number of hours (man-hours overrun) helps manage company's employee utilization and avoids overscheduling. This study applied a data analytics framework on IT project management dataset to predict the project completion time and overruns (in man-hours). We used linear regression and classification models to predict projects' performance and analyze the underlying factors causing project delay. Our predictive analysis used 131 variables which included 536 tasks, 138 resources, 69371 employee hours, 72 contractors that were assigned to 434 projects. We also calculated two new variables closeness and betweenness among project team members. Results showed that Decision Tree outperformed SVM, ANN, LDA, and logistic regression in predicting man-hours overrun. In addition, preliminary Social Network Analysis (SNA) indicates that Average-closeness and Average-betweenness did not improve prediction on the overall amount of time and man-hours overrun but improve the prediction on time overrun, but task, resource and contractor assignments variables were significant at p-value of .01. The models we used helps identify key predictors of project performance and provide insights into the company's resource management.  Using analytics to predict project management success",Monitoring and control, normally   cost overrun challenge dicting  completed expected end date  overrun  allotted  hour man hours overrun   company employee utilization avoids overscheduling study applied data analytics framework   data dict  completion  overrun man hours  linear regression classification model dict  performance analyze underlying factor   delay dictive analysis    variable    task   resource   employee hour   contractor assigned     calculated two  variable closeness betweenness among  team member   decision tree outperformed svm ann lda logistic regression dicting man hours overrun addition liminary social network analysis sna indicates average closeness average betweenness improve diction overall amount  man hours overrun improve diction  overrun task resource contractor assignment variable significant  value   model     dictor  performance provide insight company resource   analytics dict   success
71,Project performance analysis using hierarchical clustering method,This paper deals with the project management performance analysis in automotive industry and usage of the advanced analytics to optimize the performance of the engineering projects within the vehicle manufacturing facility. The aim is to identify and mitigate the common causes of project delay (slippage) in various engineering projects that are independent of the technical discipline where a particular project belongs to. We have used the hierarchical clustering technique here to identify the sub-groups of similar projects and further deeply analysed those ones with the highest average slippage. © 2021 International Journal of Emerging Technology and Advanced Engineering. All rights reserved. Project performance analysis using hierarchical clustering method,Monitoring and control, deal   performance analysis automotive industry usage advanced analytics optimize performance engineering   vehicle manufacturing facility   mitigate common   delay slippage various engineering  independent technical discipline particular  bes  hierarchical clustering technique  sub groups similar  deeply analysed  highest average slippage   international journal emerging technology advanced engineering right reserved  performance analysis  hierarchical clustering method
72,Data science approach for it project management,"Majority of the IT companies realized that ability to analyse and use data, could be one of the key factors for increasing of number of successful projects, portfolios, programs. Key performance indicators based on data analysis helps organizations be more prosperous in a long term perspective. Also, statistical data are very useful for monitoring and evaluation of project results which are very important for managers, delivery directors, CTO and others high level management of company. The Data Science methods could make more efficient project management in several of business problems. Analysis of historical data from the project life-cycle based on Data Science models could provide more efficient benefits for different stakeholders. Differential of the project data vector with target as an integral evaluation of the project success which allow for the complex correlations between separate features. Therefore, the influence of features importance and override creatures could be decreased on the target. This study propose new approach based on Data Science providing more efficient and accurately project management, taking into account best practices and project performance data. © 2019 Janis Grabis, Bohdan Haidabrus, Serhiy Protsenko, Iryna Protsenko, Anna Rovna. Data science approach for it project management",Monitoring and control,majority company   analyse  data could   factor increasing  successful   program  performance indicator based data analysis  organization prosperous   perspective  statistical data ful monitoring evaluation   important  delivery director cto others high   company data science method could  efficient    business  analysis historical data  life cycle based data science model could provide efficient benefit  stakeholder ial  data vector target integral evaluation  success allow complex correlation separate feature therefore influence feature importance override creature could decreased target study propose  approach based data science providing efficient accurately   taking account  practice  performance data   janis grabis bohdan haidabrus serhiy protsenko iryna protsenko anna rovna data science approach  
73,Data assessment model for strategic management,"A data-oriented culture enables new ways of building competitive advantage, but also requires new type of managerial skills. Despite of fast-growing attention to data assets, there are very few managerial tools for the purpose. In this paper, we propose a new data assessment model for strategic management. The model makes the organization's analytical capabilities and development needs transparent. The model consists of three phases and uses an easily communicated four-field model for mapping existing data and discovering new possibilities. The model helps to identify what datasets the organization could use in analytics and to assess them according to their strategic importance. Therefore, organization's development resources can be targeted effectively. The relevancy of the model was discovered during empirical studies with regional organizations on business analytics maturity. Data assessment model for strategic management",Monitoring and control,data oriented culture enables  way building competitive advantage  requires  type rial skill despite fast growing attention data  rial tool   propose  data assessment model strategic  model  organization analytical cap development  transparent model consists three phase  easily communicated four  model mapping existing data discovering  possibility model   datas organization could  analytics ass according strategic importance therefore organization development resource targeted effectively relevancy model discovered empirical study regional organization business analytics maturity data assessment model strategic 
74,Strategic alignment and value maximization for IT project portfolios,"Managing project portfolios has been a challenge to many IT organizations due to the size and complexity of their initiatives that are often cross-functional, fast changing, and transformational in nature. Governance on soliciting, selecting, and monitor Strategic alignment and value maximization for IT project portfolios",Monitoring and control,managing   challenge  organization due size complexity initiative  cross functional fast changing transformational  governance soliciting selecting monitor strategic alignment value maximization  
75,MERI: METHODOLOGY FOR ESTIMATING COST AND TIME RISKS IN PROJECTS USING MACHINE LEARNING. APPLICATION TO OIL&GAS INFRASTRUCTURE; [MERI: METODOLOGÍA DE ESTIMACIÓN DE RIESGOS DE COSTE Y PLAZO EN PROYECTOS MEDIANTE MACHINE LEARNING. APLICACIÓN A INFRAESTRUCT,"Historically, cost overruns in construction projects have been a major problem. Nowadays, the magnitude of this problem is completely unsustainable with cases of ""billionaire"" cost overruns all over the world. Previous works stresses the role of risk man MERI: METHODOLOGY FOR ESTIMATING COST AND TIME RISKS IN PROJECTS USING MACHINE LEARNING. APPLICATION TO OIL&GAS INFRASTRUCTURE; [MERI: METODOLOGÍA DE ESTIMACIÓN DE RIESGOS DE COSTE Y PLAZO EN PROYECTOS MEDIANTE MACHINE LEARNING. APLICACIÓN A INFRAESTRUCT",Monitoring and control,historically cost overrun construction  major  nowadays magnitude  completely unsustainable  billionaire cost overrun  vious work stress role risk man meri methodology estimating cost  risk   machine learning application  gas infrastructure meri metodologia  estimacion  riesgos  coste plazo  proyectos mediante machine learning aplicacion infraestruct
76,Risk optimization for R&D project portfolios,"R&D projects typically exist in an environment that requires management to allocate resources (staff, space, and funds) across a limited number of projects. This process can have a significant impact on the future growth and profitability of the business Risk optimization for R&D project portfolios",Monitoring and control,  typically exist environment requires  allocate resource staff space fund across limited    significant impact future growth profit business risk optimization   
77,Including oil price uncertainty in development option selection taking the project portfolio into account,"Oil price forecasting has been shown to be challenging if not impossible for the long-term. However, the oil price has a major impact on Exploration and Production projects. Historical Project Realized Oil Price (PROP) can be calculated for example proje Including oil price uncertainty in development option selection taking the project portfolio into account",Monitoring and control, price forecasting  challenging impossible     price major impact exploration production  historical    price prop calculated example proje including  price uncertainty development option selection taking   account
