,Title,Abstract,Category,Words
128,A framework for big data integration within the strategic management process based on a balanced scorecard methodology,"The purpose of this research is to study the impact of big data initiatives on strategic management processes. While the majority of strategic management disciplines have had research dedicated to the use of strategic management theories to understand how big data affect organizational performance, the body of research on big data lacks academic work capable of examining how to integrate big data into the strategic management process. The main contributions of this work are: (1) it highlights the strategic use of big data; (2) it analyses the main frameworks/models proposed by scholars that support the use of big data as a strategic management tool, and outlines this research gap; and (3) it proposes a new framework that integrates big data within the strategic management process based on a balanced scorecard methodology. © 2021 A framework for big data integration within the strategic management process based on a balanced scorecard methodology",Strategic alignment, research study impact big data initiative strategic   majority strategic  discipline research dedicated  strategic  theory understand big data affect organizational performance body research big data lack academic work capable examining integrate big data strategic   main contribution work   highlight strategic  big data   analysis main frameworks models  scholar support  big data strategic  tool outline research gap   proposes  framework integrates big data  strategic   based balanced scorecard methodology   framework big data integration  strategic   based balanced scorecard methodology
129,Integrating a Project Risk Model into a BI Architecture,"In today’s unpredictable and disruptive business landscape organizations face challenges that severely threatens their existence. To efficiently respond such challenges organizations must craft strategies to become more data-informed, agile, adaptative, and flexible. Integrating dynamic data analytical models in organizational structures to collect, analyze and interpret business data, is critical to organizations because it enables them to make more data-informed decisions and reduce bias in decision-making. In this work is illustrated the integration of a heuristic project risk-model used to identify project critical success factors into a typical organizational business intelligence architecture. The proposed integration enables organizations to efficiently and in a timely manner identify project collaborative risks by addressing people, environment, and tools, and generate actionable project-related knowledge that helps organizations to efficiently respond business challenges and achieve sustainable competitive advantages. © 2022, The Author(s), under exclusive license to Springer Nature Switzerland AG. Integrating a Project Risk Model into a BI Architecture",Strategic alignment, undictable disruptive business landscape organization  challenge severely threatens existence efficiently respond challenge organization must craft strategy  data informed agile adaptative flexible integrating dynamic data analytical model organizational structure collect analyze intert business data critical organization enables  data informed decision reduce bias decision making work illustrated integration heuristic  risk model    critical success factor typical organizational business intelligence architecture  integration enables organization efficiently  manner   collaborative risk addressing people environment tool generate actionable  related knowledge  organization efficiently respond business challenge  sustainable competitive advantage    exclusive license springer  switzerland  integrating  risk model  architecture
130,Selection of Investment Portfolio Using Multi-criteria Decision Model (MCDM) and Integer Programming Model,This paper is an attempt to select few vital investment projects among a number of feasible projects using MCDM and linear integer programming in the face of limited financial resources. The tangible and intangible considerations are taken care of using  Selection of Investment Portfolio Using Multi-criteria Decision Model (MCDM) and Integer Programming Model,Strategic alignment, attempt select  investment  among  feasible   mcdm linear integer programming  limited financial resource tangible intangible consideration taken care  selection investment   multi criteria decision model mcdm integer programming model
131,"2015 10th International Conference on Intelligent Systems: Theories and Applications, SITA 2015","The proceedings contain 70 papers. The topics discussed include: user profile model: a user dimension based classification; a theoretical e-government portals' benchmarking framework; quality of data in mediation systems; mapping discovery methodology in 2015 10th International Conference on Intelligent Systems: Theories and Applications, SITA 2015",Strategic alignment,proceeding     topic discussed   profile model  dimension based classification theoretical  government portal benchmarking framework quality data mediation  mapping discovery methodology     international conference intelligent  theory application sita  
132,Balancing the strategic value and the operational value in IT portfolio selection,"This paper provides a methodological framework in which the problem of IT project portfolio selection is solved by balancing between operational and strategic IT investments. From interviews with CIOs, we found that the interest in IT projects in many fi Balancing the strategic value and the operational value in IT portfolio selection",Strategic alignment, provides methodological framework    selection solved balancing operational strategic investment interview cio found interest    balancing strategic value operational value  selection
133,Strategic alignment and value maximization for IT project portfolios,"Managing project portfolios has been a challenge to many IT organizations due to the size and complexity of their initiatives that are often cross-functional, fast changing, and transformational in nature. Governance on soliciting, selecting, and monitor Strategic alignment and value maximization for IT project portfolios",Strategic alignment,managing   challenge  organization due size complexity initiative  cross functional fast changing transformational  governance soliciting selecting monitor strategic alignment value maximization  
134,Selecting a portfolio of projects considering both optimization and balance of sub-portfolios,"Over the past four decades, portfolio selection has been one of the most important concerns of researchers, project managers, project-oriented companies, and public agencies around the world. Although numerous studies have been done in this field, still  Selecting a portfolio of projects considering both optimization and balance of sub-portfolios",Strategic alignment,past four decade  selection  important concern researcher    oriented company  agency    numerous study   still selecting   considering optimization balance sub 
135,Big data analytics in innovation processes: which forms of dynamic capabilities should be developed and how to embrace digitization?,"Purpose: The purpose of this paper is to analyze, from a dynamic capabilities perspective, the role of big data analytics in supporting firms' innovation processes. 
Design/methodology/approach: Relevant literature is reviewed and critically assessed. An interpretive methodology is used to analyze empirical data from interviews of big data analytics experts at firms within digitally related sectors. 
Findings: This study shows how firms leverage big data to gain “richer” and “deeper” data at the inter-sections between the digital and physical worlds. The authors provide evidence for the importance of counterintuitive strategies aimed at developing innovative products, services or solutions with characteristics that may initially diverge, even significantly, from established customer/user needs. 
Practical implications: The authors’ findings offer insights to help practitioners manage innovation processes in the physical world while taking investments in big data analytics into account. 
Originality/value: The authors provide insights into the evolution of scholarly research on innovation directed toward opportunities to create a competitive advantage by offering new products, services or solutions diverging, even significantly, from established customer demand. © 2021, Rosita Capurro, Raffaele Fiorentino, Stefano Garzella and Alessandro Giudici. Big data analytics in innovation processes: which forms of dynamic capabilities should be developed and how to embrace digitization?",Strategic alignment,   analyze dynamic cap perspective role big data analytics supporting firm innovation  design methodology approach relevant literature reviewed critically assessed intertive methodology  analyze empirical data interview big data analytics expert firm  digitally related sector finding study  firm leverage big data gain richer deeper data inter sections digital physical   provide evidence importance counterintuitive strategy  developing innovative product service solution characteristic may initially diverge even significantly established customer   practical implication  finding offer insight  practitir  innovation  physical  taking investment big data analytics account originality value  provide insight evolution scholarly research innovation directed toward opportunity create competitive advantage offering  product service solution diverging even significantly established customer demand   rosita capurro raffaele fiorentino stefano garzella alessandro giudici big data analytics innovation  form dynamic cap  embrace digitization
136,Big Data in Portfolio Allocation: A New Approach to Successful Portfolio Optimization,"In the classic mean-variance portfolio theory as proposed by Harry Markowitz, the weights of the optimized portfolios are directly proportional to the inverse of the asset correlation matrix. However, most contemporary portfolio optimization research focuses on optimizing the correlation matrix itself, and not its inverse. In this article, the author demonstrates that this is a mistake. Specifically, from the Big Data perspective, she proves that the inverse of the correlation matrix is much more unstable and sensitive to random perturbations than is the correlation matrix itself. As such, optimization of the inverse of the correlation matrix adds more value to optimal portfolio selection than does optimization of the correlation matrix. The author further shows the empirical results of portfolio reallocation under different common portfolio composition scenarios. The technique outperforms traditional portfolio allocation techniques out of sample, delivering nearly 400% improvement over the equally weighted allocation over a 20-year investment period on the S&P 500 portfolio with monthly reallocation. In general, the author demonstrates that the correlation inverse optimization proposed in this article significantly outperforms the other core portfolio allocation strategies, such as equally weighted portfolios, vanilla mean-variance optimization, and techniques based on the spectral decomposition of the correlation matrix. The results presented in this article are novel in the data science space, extend far beyond financial data, and are applicable to any data correlation matrixes and their inverses, whether in advertising, healthcare, or genomics. © 2019 Pageant Media Ltd. Big Data in Portfolio Allocation: A New Approach to Successful Portfolio Optimization",Strategic alignment,classic mean variance  theory  harry markowitz weight optimized  directly proportional inverse  correlation matrix  contemporary  optimization research  optimizing correlation matrix inverse article  demonstrates mistake specifically big data perspective prof inverse correlation matrix much unstable sensitive random perturbation correlation matrix optimization inverse correlation matrix add value optimal  selection optimization correlation matrix   empirical   reallocation  common  composition scenario technique outperforms traditional  allocation technique sample delivering nearly   improvement equally weighted allocation  year investment period     monthly reallocation general  demonstrates correlation inverse optimization  article significantly outperforms core  allocation strategy equally weighted  vanilla mean variance optimization technique based spectral decomposition correlation matrix   article novel data science space extend far beyond financial data  data correlation matrix inverse whether advertising healthcare genomics   pageant medium ltd big data  allocation  approach successful  optimization
137,Information technology (IT) project portfolio management practices in South Africa,"Many organisations have adopted Project Portfolio Management (PPM) processes to improve the implementation of their strategies, however few organisations have achieved tangible returns on investment (ROI) from PPM. Although PPM stakeholders are aware tha Information technology (IT) project portfolio management practices in South Africa",Strategic alignment, organisation adopted    ppm  improve implementation strategy  organisation  tangible return investment roi ppm  ppm stakeholder aware tha information technology    practice south africa
138,"Comparison of project portfolio management practices in the public and private sectors in Brazil: Characteristics, similarities, and differences","Purpose: Project portfolio management (PPM) is a managerial technique used to seek the strategic goals of organizations improving their performance. The public sector has some characteristics that differ from the private sector, since their management ap Comparison of project portfolio management practices in the public and private sectors in Brazil: Characteristics, similarities, and differences",Strategic alignment,    ppm rial technique  seek strategic goal organization improving performance  sector characteristic differ private sector since   comparison    practice  private sector brazil characteristic similarity difference
139,"Project valuation, capital investment and strategic alignment - Tools and techniques at Anglo Platinum","Central to the success of any mining company is the ability to manage capital investment effectively so as to ensure acceptable stakeholder returns within an overall strategic context Critical to this process is the effective selection and implementation Project valuation, capital investment and strategic alignment - Tools and techniques at Anglo Platinum",Strategic alignment,central success mining company   capital investment effectively ensure acceptable stakeholder return  overall strategic context critical  effective selection implementation  valuation capital investment strategic alignment tool technique anglo platinum
140,Portfolio of projects: Case study of selection and balancing; [Seleção e alocação de recursos em portfólio de projetos: Estudo de caso no setor químico],"Among dozens or hundreds of alternatives, choosing those which should make up the projects portfolio of an organization and which priority level is a complex multi-criteria decision matter. This work aims to apply a management model of projects portfolio Portfolio of projects: Case study of selection and balancing; [Seleção e alocação de recursos them portfólio de projetos: Estudo de caso no setor químico]",Strategic alignment,among dozen hundred alternative choosing    organization priority  complex multi criteria decision matter work  apply  model      study selection balancing selecao  alocacao  recursos   projetos estudo  caso  quimico
141,Selecting a portfolio of projects considering both optimization and balance of sub-portfolios,"Over the past four decades, portfolio selection has been one of the most important concerns of researchers, project managers, project-oriented companies, and public agencies around the world. Although numerous studies have been done in this field, still  Selecting a portfolio of projects considering both optimization and balance of sub-portfolios",Strategic alignment,past four decade  selection  important concern researcher    oriented company  agency    numerous study   still selecting   considering optimization balance sub 
142,Modeling a business intelligence system for investment projects,"The phases of evaluation and selection of investment projects require marketing, technical and financial information analysis before the decisions are made. In order to meet strict legal environmental and fiscal regulations it is necessary to assess the environmental and social impact. These analysis may indicate alternative sites, models, technologies, and methods of implementation as solutions for executing the project, which often involve higher costs, and because delays in the feasibility analysis and project selection. The purpose of this empirical research is to reduce the effort and duration of the selection and evaluation of projects and project portfolio optimization, increasing the efficiency and accuracy of budget implementation and controlling in accordance with the investment strategy of the company. The results consist of a set of requirements for a specific business intelligence system, designed to improve the operational flow and the performance of the planning process, and an analysis of significant factors underlying performance differences between projected and actual achievements, to define the parameters of the model. © 2015,Academy of Economic Studies, All right reserved. Modeling a business intelligence system for investment projects",Strategic alignment,phase evaluation selection investment  require marketing technical financial information analysis decision made order meet strict legal environmental fiscal regulation necessary ass environmental social impact analysis may indicate alternative  model technology method implementation solution executing   involve higher cost delay feasibility analysis  selection  empirical research reduce effort duration selection evaluation    optimization increasing efficiency accuracy budget implementation controlling accordance investment strategy company  consist  requirement specific business intelligence  designed improve operational flow performance planning  analysis significant factor underlying performance difference  actual ment define parameter model   academy economic study right reserved modeling business intelligence  investment 
143,Selection of Investment Portfolio Using Multi-criteria Decision Model (MCDM) and Integer Programming Model,This paper is an attempt to select few vital investment projects among a number of feasible projects using MCDM and linear integer programming in the face of limited financial resources. The tangible and intangible considerations are taken care of using  Selection of Investment Portfolio Using Multi-criteria Decision Model (MCDM) and Integer Programming Model,Strategic alignment, attempt select  investment  among  feasible   mcdm linear integer programming  limited financial resource tangible intangible consideration taken care  selection investment   multi criteria decision model mcdm integer programming model
144,"Comparison of project portfolio management practices in the public and private sectors in Brazil: Characteristics, similarities, and differences","Purpose: Project portfolio management (PPM) is a managerial technique used to seek the strategic goals of organizations improving their performance. The public sector has some characteristics that differ from the private sector, since their management ap Comparison of project portfolio management practices in the public and private sectors in Brazil: Characteristics, similarities, and differences",Strategic alignment,    ppm rial technique  seek strategic goal organization improving performance  sector characteristic differ private sector since   comparison    practice  private sector brazil characteristic similarity difference
145,"Project valuation, capital investment and strategic alignment - Tools and techniques at Anglo Platinum","Central to the success of any mining company is the ability to manage capital investment effectively so as to ensure acceptable stakeholder returns within an overall strategic context Critical to this process is the effective selection and implementation Project valuation, capital investment and strategic alignment - Tools and techniques at Anglo Platinum",Strategic alignment,central success mining company   capital investment effectively ensure acceptable stakeholder return  overall strategic context critical  effective selection implementation  valuation capital investment strategic alignment tool technique anglo platinum
146,IT project portfolio selection decision model based on strategic alignment,The objective of this paper is to construct a fuzzy IT project portfolio selection model based on strategic alignment. Fuzzy set theory is applied to model uncertain project information and a fuzzy analytic net process (FANP) frame integrated with critic IT project portfolio selection decision model based on strategic alignment,Strategic alignment,objective  construct fuzzy   selection model based strategic alignment fuzzy  theory applied model uncertain  information fuzzy analytic net  fanp frame integrated critic   selection decision model based strategic alignment
147,Aligning construction projects with strategy,This chapter explores the alignment of construction projects with strategy through several case studies and offers insights for the development of project portfolio management (PPM) capabilities in construction. Most PPM research occurs in industries ass Aligning construction projects with strategy,Strategic alignment,chapter explores alignment construction  strategy   study offer insight development    ppm cap construction ppm research occurs industry  aligning construction  strategy
148,A Data-driven project categorization process for portfolio selection,"Purpose: Categorizing projects allows for better alignment of a portfolio with the organizational strategy and goals. An appropriate project categorization helps understand portfolio’s structure and enables proper project portfolio selection (PPS). In practice, project categorization is, however, conducted in intuitive approaches. Furthermore, little attention has been given to project categorization methods in the project management literature. The purpose of this paper is to provide researchers and practitioners with a data-driven project categorization process designed for PPS. Design/methodology/approach: The suggested process was modeled considering the main characteristics of project categorization systems revealed from the literature. The clustering analysis is used as the core-computing technology, allowing for an empirically based categorization. This study also presents a real-world case study in the automotive industry to illustrate the proposed approach. Findings: This study confirmed the potential of clustering analysis for a consistent project categorization. The most important attributes that influenced the project grouping have been identified including strategic and intrinsic features. The proposed approach helps increase the visibility of the portfolio’s structure and the comparability of its components. Originality/value: There is a lack of research regarding project categorization methods, particularly for the purpose of PPS. A novel data-driven process is proposed to help mitigate the issues raised by prior researchers including the inconsistencies, ambiguities and multiple interpretations related to the taken-for-granted categories. The suggested approach is also expected to facilitate projects evaluation and prioritization within appropriate categories and contribute in PPS effectiveness. © 2021, Emerald Publishing Limited. A Data-driven project categorization process for portfolio selection",Strategic alignment, categorizing  allows better alignment  organizational strategy goal appropriate  categorization  understand  structure enables proper   selection pps practice  categorization  conducted intuitive approach furthermore little attention   categorization method   literature   provide researcher practitir data driven  categorization  designed pps design methodology approach suggested  modeled considering main characteristic  categorization  revealed literature clustering analysis  core computing technology allowing empirically based categorization study   real   study automotive industry illustrate  approach finding study confirmed potential clustering analysis consistent  categorization important attribute influenced  grouping identified including strategic intrinsic feature  approach  increase visibility  structure compar compnt originality value lack research regarding  categorization method particularly  pps novel data driven    mitigate issue raised prior researcher including inconsistency ambiguity multiple intertation related taken for granted category suggested approach  expected facilitate  evaluation prioritization  appropriate category contribute pps effectiveness   emerald publishing limited data driven  categorization   selection
