Title,Link,Abstract,Name,Category,Criteria
A Sustainability Assessment Framework for On-Site and Off-Site Construction Logistics,https://www.scopus.com/inward/record.uri?eid=2-s2.0-85137181334&doi=10.3390%2fsu14148573&partnerID=40&md5=493c813c6c30772e55d0d11ae4139fc6,"Urban areas pay increasing attention to new construction and infrastructure works, mainly due to the rapid global rise in urbanisation. In the long run, these works have a positive correlation with the economic and social attractiveness of cities. Constr",Change Management - Identification of changes,Change Management,Identification of changes
"A project prioritization approach considering uncertainty, reliability, criteria prioritization, and robustness",https://www.scopus.com/inward/record.uri?eid=2-s2.0-85124176560&doi=10.1016%2fj.dss.2022.113731&partnerID=40&md5=2c84629f4762ff00a2231149b9248def,"Given the limitation of resources in organizations (time, money, staff, material, etc.), deciding which projects should be given priority ? among many competing projects ? is a constant and continuous challenge for decision makers. As a result, a prolife",Change Management - Identification of changes,Change Management,Identification of changes
"International Conference on Information Systems, ICIS 2012, Volume 5",https://www.scopus.com/inward/record.uri?eid=2-s2.0-84886550717&partnerID=40&md5=2441a03d215ae7a1b04bc5151531cada,The proceedings contain 308 papers. The special focus in this conference is on Information Systems. The topics include: Heterogeneity in IT landscapes and monopoly power of firms; community ecology for innovation concept; peer influence in a very large s,Change Management - Identification of changes,Change Management,Identification of changes
Project portfolio management: A powerful strategic weapon in pharmaceutical drug development,https://www.scopus.com/inward/record.uri?eid=2-s2.0-84993767767&doi=10.1177%2f009286159803200321&partnerID=40&md5=6171aaa112359b99cfc87d86cdc9831a,"International pharma market dynamics increasingly require that pharmaceutical companies add value to their organizations at all levels. In this respect, strategic research and development (R&D) portfolio management constitutes an extremely important tool",Change Management - Identification of changes,Change Management,Identification of changes
"A framework for developing performance objectives for projects, programs, and portfolios",https://www.scopus.com/inward/record.uri?eid=2-s2.0-85061752332&doi=10.1201%2fb18986&partnerID=40&md5=b24bd78afa9bee4addb26677df703dfe,"Performance objectives are those key considerations or requirements of the stakeholders that form the basis or lens through which they view the temporary organization (i.e., a project, portfolio, or program). The ability to identify and agree on the key ",Stakeholder management- Stakeholder identification,"",akeholder management- Stakeholder identification
Project portfolio risk response selection using bayesian belief networks,https://www.scopus.com/inward/record.uri?eid=2-s2.0-85105848719&doi=10.22059%2fIJMS.2020.272892.673461&partnerID=40&md5=fa9a7ed566a70258a5ce4bb2c1192e71,"Risk identification, impact assessment, and response planning constitute three building blocks of project risk management. Correspondingly, three types of interactions could be envisioned between risks, between impacts of several risks on a portfolio com",Risk management - Risk response,Risk management,Risk response
Risk Response Strategies Selection over the Life Cycle of Project Portfolio,https://www.scopus.com/inward/record.uri?eid=2-s2.0-85144907528&doi=10.3390%2fbuildings12122191&partnerID=40&md5=5e86ed19a4e5dc7126af0389a9d2617d,"The successful implementation of project portfolios (PP) calls for effective risk management, in which selecting optimal risk response strategies help to reduce the impact of risk. Project portfolio risks (PPRs) exhibit causality and time dependency over",Risk management - Risk response,Risk management,Risk response
A portfolio risk response strategies selection model considering interference of strategy realization and two-level correlation of risks; [??????????????????????????????],https://www.scopus.com/inward/record.uri?eid=2-s2.0-85163877421&doi=10.13195%2fj.kzyjc.2021.2141&partnerID=40&md5=767e9c50ca842cdcc1d3abc21dd1e703,"Due to the influence of project portfolio risks, project portfolios can not effectively support the realization of enterprise strategies. Therefore, enterprises need to adopt appropriate risk response strategies to ensure the project portfolio success, b",Risk management - Risk response,Risk management,Risk response
R&D projects selection in telecommunications under uncertainty and resource restrictions using scheduling,https://www.scopus.com/inward/record.uri?eid=2-s2.0-85026217356&doi=10.1109%2fICCW.2017.7962838&partnerID=40&md5=443f17c8066338c9db5ea3def49ecc9b,"Telecommunications R&D organizations, as inserted in a high-technology market environment, need to develop continuously projects. Considering it, a formal approach for project selection is needed, once, in general, there is no enough funding for all of t",Risk management - Risk response,Risk management,Risk response
Project Risk Response Decision Making Under Uncertain Project Interdependencies,https://www.scopus.com/inward/record.uri?eid=2-s2.0-85161074575&doi=10.1109%2fTEM.2023.3271991&partnerID=40&md5=2ac338e908f9aed5b1e140cf378e7568,"Project portfolio (PP) risk management entails making risk response decisions (RRDs) on single projects within PPs (SPPPs). However, the presence of uncertain project interdependencies (UPIs) increases the difficulty of RRDs. This study provides a decisi",Risk management - Risk response,Risk management,Risk response
System dynamics application in analyzing the schedule risk influence on project portfolio,https://www.scopus.com/inward/record.uri?eid=2-s2.0-79551551478&partnerID=40&md5=f1c19f611aa1169fbb99e067016347ed,"Due to the interaction between multiple projects and programs, the project portfolio can be regarded as a complicated system. Schedule risk of individual projects will be delivered to the inner portfolio according to this internal relationship of project",Risk management - Risk analysis,Risk management,Risk analysis
"Data-driven analysis of ""corporate risk"" using historical cost-control data",https://www.scopus.com/inward/record.uri?eid=2-s2.0-0004399146&doi=10.1061%2f%28ASCE%290733-9364%281998%29124%3a1%2842%29&partnerID=40&md5=94cef4be03c3cfd627359385247966e4,"The process of risk management includes three phases of risk identification, risk quantification, and risk control. Of the three phases, many managers agree that the major benefits of risk management are derived from the insights through the way project ",Risk management - Risk analysis,Risk management,Risk analysis
the evaluation of innovation projects,https://www.scopus.com/inward/record.uri?eid=2-s2.0-84981632155&doi=10.1111%2fj.1467-9310.1972.tb00103.x&partnerID=40&md5=0b4d861ef450a0e77a86b01b10108789,Abstract. Any realistic assessment of research projects must allow for possible failures. Scaling down the Potential gain from each project by its probability of achievement ignores the expenditure on unsuccessful projects and is therefore misleading. Th,Risk management - Risk analysis,Risk management,Risk analysis
Development of natural gas assets in frontier offshore areas under challenging technical and economic environment - A project finance with real options approach,https://www.scopus.com/inward/record.uri?eid=2-s2.0-85040465040&doi=10.2118%2f187031-ms&partnerID=40&md5=69a601eb83f647f172cbc0ce627d57aa,"Gas field developments have been fundamental in the transition of moving toward a cleaner worldwide energy matrix. These developments normally flourish in the presence of large volumes, suitable infrastructure and committed demand through long-term contr",Risk management - Risk analysis,Risk management,Risk analysis
Exploring the structures and design effects of EU-funded R&D&I project portfolios,https://www.scopus.com/inward/record.uri?eid=2-s2.0-85128333025&doi=10.1016%2fj.techfore.2022.121687&partnerID=40&md5=5d2ca8116542e6a8b6eb8322f73480f3,"Joint R&D&I projects and programs increase performance but entail project-related risks; namely, concurrent projects may share resources, delays may be inherited by later projects, and costs may overrun. With a project portfolio, one can better plan budg",Risk management - Risk analysis,Risk management,Risk analysis
"Portfolio management in commercially oriented businesses: Project selection, prioritization and measurement",https://www.scopus.com/inward/record.uri?eid=2-s2.0-84881563890&partnerID=40&md5=79c25964f98463731efe85bd24841bc6,"In a commercially focused project oriented business, project identification, selection and execution determine profitability. A business must measure, rank and prioritize its commercial projects to ensure resources are allocated to the high priority comp",Risk management - risk identification,Risk management,risk identification
Moresa: confronting risks in a highly uncertain environment,https://www.scopus.com/inward/record.uri?eid=2-s2.0-85144064827&doi=10.1108%2fEEMCS-08-2022-0275&partnerID=40&md5=0b77d0c74bed0fa9fc4af9ba0c27a886,Learning outcomes: At the end of the case students will be able to: 1. Relate risk as one of the 12 principles in project management contemplated in the international standards of the PMBOK Seventh Edition guide. 2. Determine high-level risks by articula,Risk management - risk identification,Risk management,risk identification
New discovery as a result of complex approach to brownfield region evaluation,https://www.scopus.com/inward/record.uri?eid=2-s2.0-85039151133&doi=10.24887%2f0028-2448-2017-12-20-23&partnerID=40&md5=86bb0a76151793be5b87b24f884fcdfe,"Currently many prospective areas within Western Siberia still remain understudied and potentially promising, despite the huge amount of exploration works. These areas are mostly tending to be located at the side parts of the basin. Because of significant",Risk management - risk identification,Risk management,risk identification
A Real Option based Six Sigma project evaluation and selection model,https://www.scopus.com/inward/record.uri?eid=2-s2.0-80053053930&doi=10.1016%2fj.ijproman.2011.01.011&partnerID=40&md5=739177f872c7a64530e04fe8c25e1a35,Identification and selection of Six Sigma projects are one of the most frequently discussed issues in the Six Sigma literatures today. In this paper a two-stage methodology has been proposed based on (i) Real Option Analysis for evaluating the value of t,Risk management - risk identification,Risk management,risk identification
"Project portfolio risk identification and analysis, considering project risk interactions and using Bayesian Networks",https://www.scopus.com/inward/record.uri?eid=2-s2.0-85047019176&doi=10.3390%2fsu10051609&partnerID=40&md5=abe9156e5b33e28ff7cf9ec2dc7c7bc0,"An organization's strategic objectives are accomplished through portfolios. However, the materialization of portfolio risks may affect a portfolio's sustainable success and the achievement of those objectives. Moreover, project interdependencies and caus",Risk management - risk identification,Risk management,risk identification
D-WASPAS: Addressing Social Cognition in Uncertain Decision-Making with an Application to a Sustainable Project Portfolio Problem,https://www.scopus.com/inward/record.uri?eid=2-s2.0-85074895885&doi=10.1007%2fs12559-019-09679-3&partnerID=40&md5=a71a2572d777a441aa48485f0c69aae5,"Decision-making is an interdisciplinary area that has roots in mathematics, economics, and social science. Multiple-criteria group decision-making (MCGDM) is one of the most applicable areas of decision-making. Social cognition is involved in group decis",Value management - Monitoring and measuring value,Value management,Monitoring and measuring value
Managing big data of offshore project lifecycle through investment information system,https://www.scopus.com/inward/record.uri?eid=2-s2.0-85088764343&doi=10.4043%2f28602-ms&partnerID=40&md5=dba06e4d7968ee942700f0844ae9ae39,"Big Data is popular term in some recent years and become leverage for business trend around the world. Absolutely 100% agree, all the business uses Information Technology for expanding their business and even survive on the market. IT is not supporting b",Value management - Monitoring and measuring value,Value management,Monitoring and measuring value
Vaikuttavaa tutkimusta arviointikäytäntöjä julkisissa tutkimusorganisaatioissa: Helia ja SAMK,https://www.scopus.com/inward/record.uri?eid=2-s2.0-33750401679&partnerID=40&md5=6df2c8b7a208253e965583ffdc4ee3e0,"The role of the polytechnics (also referred to as ""universities of applied sciences"") in the Finnish innovation system has, from rather humble beginnings, steadily increased in importance. The development of their knowledge base has become an integral pa",Value management - Monitoring and measuring value,Value management,Monitoring and measuring value
A scenario-based mathematical approach to a robust project portfolio selection problem under fuzzy uncertainty,https://www.scopus.com/inward/record.uri?eid=2-s2.0-85127399665&doi=10.3233%2fJIFS-210144&partnerID=40&md5=58c7af13384e3b991dcca5e8689bab8e,"As a major concern of chief managers in each organization, project portfolio selection has a special place in their responsibilities. To assist managers in making decisions, applicable optimization models play an essential role in such processes. In this",Value management - Monitoring and measuring value,Value management,Monitoring and measuring value
The impact made on project portfolio optimisation by the selection of various risk measures,https://www.scopus.com/inward/record.uri?eid=2-s2.0-85046820422&doi=10.5755%2fj01.ee.29.2.17405&partnerID=40&md5=406f3ac2955a91edccec0836e24024ba,This study addresses the effect of selecting an appropriate risk measure and the impact of this choice on the efficient frontier of the project portfolio of an organisation. The appropriate choice of a firm?s project portfolio has a great impact on the o,Value management - Monitoring and measuring value,Value management,Monitoring and measuring value
Decision programming for mixed-integer multi-stage optimization under uncertainty,https://www.scopus.com/inward/record.uri?eid=2-s2.0-85122023970&doi=10.1016%2fj.ejor.2021.12.013&partnerID=40&md5=378a2aebd42c0cc8bc243968f4cea670,"Influence diagrams are widely employed to represent multi-stage decision problems in which each decision is a choice from a discrete set of alternative courses of action, uncertain chance events have discrete outcomes, and prior decisions may influence t",Value management - Criteria for setting value objectives,Value management,Criteria for setting value objectives
Exploring the link between PPM implementation and company success in achieving strategic goals: An empirical framework,https://www.scopus.com/inward/record.uri?eid=2-s2.0-84996790726&doi=10.7166%2f27-3-1635&partnerID=40&md5=3e08d05335b3bbd66ed3e8658e7a6eaf,"Organisations are constantly under pressure to innovate and grow by successfully executing their business strategies. The ever-increasing rate of change in technology has implications for product lifecycles, cost pressures, expectations of higher quality",Value management - Maximizing value,Value management,Maximizing value
Value-oriented IT project portfolio management,https://www.scopus.com/inward/record.uri?eid=2-s2.0-34047246338&doi=10.1007%2f0-387-34456-x_22&partnerID=40&md5=94ae0d80c2f19052f116aaeaebeeeb72,"In the present enterprise computing environment, it becomes more and more important to be able to demonstrate financial gains of IT (Information Technology) initiatives compared to their cost. A valuation methodology is a logical, repeatable framework fo",Value management - Maximizing value,Value management,Maximizing value
Strategic alignment and value maximization for IT project portfolios,https://www.scopus.com/inward/record.uri?eid=2-s2.0-84900458839&partnerID=40&md5=cc50a8e2617fbba1a11b4b226bc6249e,"Managing project portfolios has been a challenge to many IT organizations due to the size and complexity of their initiatives that are often cross-functional, fast changing, and transformational in nature. Governance on soliciting, selecting, and monitor",Monitoring and control - Monitoring of portfolio risks,Monitoring and control,Monitoring of portfolio risks
MERI: METHODOLOGY FOR ESTIMATING COST AND TIME RISKS IN PROJECTS USING MACHINE LEARNING. APPLICATION TO OIL&GAS INFRASTRUCTURE; [MERI: METODOLOGÍA DE ESTIMACIÓN DE RIESGOS DE COSTE Y PLAZO EN PROYECTOS MEDIANTE MACHINE LEARNING. APLICACIÓN A INFRAESTRUCT,https://www.scopus.com/inward/record.uri?eid=2-s2.0-85150371539&partnerID=40&md5=5daf4558af7189cde3fb60241e1c5128,"Historically, cost overruns in construction projects have been a major problem. Nowadays, the magnitude of this problem is completely unsustainable with cases of ""billionaire"" cost overruns all over the world. Previous works stresses the role of risk man",Monitoring and control - Monitoring of portfolio risks,Monitoring and control,Monitoring of portfolio risks
Risk optimization for R&D project portfolios,https://www.scopus.com/inward/record.uri?eid=2-s2.0-22544441875&partnerID=40&md5=9e525d06482674d33976bcc0629341e4,"R&D projects typically exist in an environment that requires management to allocate resources (staff, space, and funds) across a limited number of projects. This process can have a significant impact on the future growth and profitability of the business",Monitoring and control - Monitoring of portfolio risks,Monitoring and control,Monitoring of portfolio risks
Including oil price uncertainty in development option selection taking the project portfolio into account,https://www.scopus.com/inward/record.uri?eid=2-s2.0-85085851834&doi=10.2118%2f195440-ms&partnerID=40&md5=c5428b351fac0cf90915fc19e63f3b44,"Oil price forecasting has been shown to be challenging if not impossible for the long-term. However, the oil price has a major impact on Exploration and Production projects. Historical Project Realized Oil Price (PROP) can be calculated for example proje",Monitoring and control - Monitoring of portfolio risks,Monitoring and control,Monitoring of portfolio risks
Towards risk-aware scheduling of enterprise architecture roadmaps,https://www.scopus.com/inward/record.uri?eid=2-s2.0-85067469122&doi=10.5220%2f0007799806960702&partnerID=40&md5=d637fcb7c1d4b6fe36de94844411e8e6,Enterprises need to keep their organisation aligned with their business objectives. Enterprise Architecture provides a way to identify the current and target states as well as defining the evolution roadmap taking the form of a complex project portfolio.,Monitoring and control - Monitoring of portfolio risks,Monitoring and control,Monitoring of portfolio risks
Optimal project portfolio selection with reinvestment strategy considering sustainability in an uncertain environment: a multi-objective optimization approach,https://www.scopus.com/inward/record.uri?eid=2-s2.0-85108621786&doi=10.1108%2fK-11-2020-0737&partnerID=40&md5=5459118c4bc044ed6d51e32528fdbf66,"Purpose: This study aims to develop a model for project portfolio selection considering organizational goals such as budgets, sustainability cash flow and reinvestment strategy under an uncertain environment. Design/methodology/approach: A multi-objectiv",Monitoring and control - Value reporting and analysis,Monitoring and control,Value reporting and analysis
Vaikuttavaa tutkimusta arviointikäytäntöjä julkisissa tutkimusorganisaatioissa: Helia ja SAMK,https://www.scopus.com/inward/record.uri?eid=2-s2.0-33750401679&partnerID=40&md5=6df2c8b7a208253e965583ffdc4ee3e0,"The role of the polytechnics (also referred to as ""universities of applied sciences"") in the Finnish innovation system has, from rather humble beginnings, steadily increased in importance. The development of their knowledge base has become an integral pa",Monitoring and control - Value reporting and analysis,Monitoring and control,Value reporting and analysis
"ROI, the business case, and bottom-line impact",https://www.scopus.com/inward/record.uri?eid=2-s2.0-4444368540&partnerID=40&md5=63cd7c9c8359efdf2d49a2b3e04a9b6a,The issue of analyzing information technology (IT)-related projects for specific evidence of business value and return on investment (ROI) is discussed. ROI calculations improve project selection and better business cases lead to strong IT portfolios. Th,Monitoring and control - Value reporting and analysis,Monitoring and control,Value reporting and analysis
Including oil price uncertainty in development option selection taking the project portfolio into account,https://www.scopus.com/inward/record.uri?eid=2-s2.0-85085851834&doi=10.2118%2f195440-ms&partnerID=40&md5=c5428b351fac0cf90915fc19e63f3b44,"Oil price forecasting has been shown to be challenging if not impossible for the long-term. However, the oil price has a major impact on Exploration and Production projects. Historical Project Realized Oil Price (PROP) can be calculated for example proje",Monitoring and control - Value reporting and analysis,Monitoring and control,Value reporting and analysis
USING MONTE CARLO SIMULATION TO QUANTIFY THE COST IMPACT OF SYSTEMIC RISK FACTORS IN A PROJECT PORTFOLIO: A CASE STUDY,https://www.scopus.com/inward/record.uri?eid=2-s2.0-85122476939&doi=10.7166%2f32-4-2518&partnerID=40&md5=d3f46fcca761b5ddc20c97d3838595c2,"In terms of project risk management, ?systemic risk? is identified as risks which are artefacts of the environment which a project is executed in, and are related to (i) the project team?s actions, (ii) how project controls are managed and interact, and ",Monitoring and control - Value reporting and analysis,Monitoring and control,Value reporting and analysis
"International Conference on Information Systems, ICIS 2012, Volume 5",https://www.scopus.com/inward/record.uri?eid=2-s2.0-84886550717&partnerID=40&md5=2441a03d215ae7a1b04bc5151531cada,The proceedings contain 308 papers. The special focus in this conference is on Information Systems. The topics include: Heterogeneity in IT landscapes and monopoly power of firms; community ecology for innovation concept; peer influence in a very large s,Monitoring and control - Capabilities and performance,Monitoring and control,Capabilities and performance
Balancing the portfolio of urban and public projects with distance-dependent coverage facilities,https://www.scopus.com/inward/record.uri?eid=2-s2.0-85116974603&doi=10.24200%2fSCI.2019.52470.2730&partnerID=40&md5=8ca7e933c8d7612a8481103e5563d724,"The portfolio of urban and public projects should be balanced in terms of completion time, districts, and strategic objectives. For this purpose, we suggest a mixed-integer nonlinear programming model based on the goal programming approach. Projects are ",Monitoring and control - Capabilities and performance,Monitoring and control,Capabilities and performance
"15th Wuhan International Conference on E-Business, WHICEB 2016",https://www.scopus.com/inward/record.uri?eid=2-s2.0-85138749914&partnerID=40&md5=8cd99d2611a4f033bac6ebe13951e823,The proceedings contain 70 papers. The special focus in this conference is on E-Business. The topics include: An Empirical Research on Hotel Revenue Management Financial Performance Influencing Factors; an Empirical Research on the Evaluation System of C,Monitoring and control - Capabilities and performance,Monitoring and control,Capabilities and performance
"International Conference on Information Systems, ICIS 2012, Volume 4",https://www.scopus.com/inward/record.uri?eid=2-s2.0-84886483021&partnerID=40&md5=70b50ba9af00fc697b1ff4ef4921fad6,The proceedings contain 308 papers. The special focus in this conference is on Information Systems. The topics include: Heterogeneity in IT landscapes and monopoly power of firms; community ecology for innovation concept; peer influence in a very large s,Monitoring and control - Capabilities and performance,Monitoring and control,Capabilities and performance
"International Conference on Information Systems, ICIS 2012, Volume 1",https://www.scopus.com/inward/record.uri?eid=2-s2.0-84886536369&partnerID=40&md5=9ad75527585a4798835d4fbb73864ebf,The proceedings contain 308 papers. The special focus in this conference is on Information Systems. The topics include: Heterogeneity in IT landscapes and monopoly power of firms; community ecology for innovation concept; peer influence in a very large s,Monitoring and control - Capabilities and performance,Monitoring and control,Capabilities and performance
Optimal project portfolio selection with reinvestment strategy considering sustainability in an uncertain environment: a multi-objective optimization approach,https://www.scopus.com/inward/record.uri?eid=2-s2.0-85108621786&doi=10.1108%2fK-11-2020-0737&partnerID=40&md5=5459118c4bc044ed6d51e32528fdbf66,"Purpose: This study aims to develop a model for project portfolio selection considering organizational goals such as budgets, sustainability cash flow and reinvestment strategy under an uncertain environment. Design/methodology/approach: A multi-objectiv",Monitoring and control - Metrics for monitoring project portfolio,Monitoring and control,Metrics for monitoring project portfolio
